,tweet
0,Bloodbath!!!
1,A Republican house has to vote to defund this nonsense. At this point NPR is nothing more than a taxpayer funded leftist super PAC.
2,Maricopa County peeps get out and vote. If you’re in line when polls close they have to let you vote. Get out there and let’s turn Arizona red. Don’t take any chances do it now!!! #az #Arizona
3,Arizona patriots - We need all of you to swamp the polls in support of Kari Lake and Blake Masters. And STAY IN LINE no matter what. We can win this!!!
4,"Top Republicans to Arizona Voters: Stay in Line, Don't Leave Polling Places https://t.co/mExVDUn2X1"
5,"To all my Arizona friends: Your vote could be a difference-maker. Get to the polls. Once you’re there, stay in line no matter what, and cast your ballot. This is going to be a great day! Do your part and let’s win! #ArizonaFirst @bgmasters @KariLake @AbrahamHamadeh @AZGOP"
6,"If “destroying democracy” means voting to save our economy, allow law enforcement to do its job, bring safety back to our cities, not let teachers convince toddlers they’re another gender, becoming energy independent again, being sane… than I guess I’m about to destroy democracy"
7,Thread!!!
8,"Go overwhelm the BS. If you absolutely have to come back later, but cast your vote at all costs!!!"
9,"Einstein’s definition of insanity is doing the same thing over and over again and expecting a different result. 

If you’ve watched your cities turn to crap, your economy go to hell and your families safety become jeopardized because of Democrat policies… STOP VOTING FOR THEM!"
10,"We Ask Special Guest Donald Trump, Jr. Is His Dad Running In 2024 https://t.co/ony8Xz9Hj1"
11,"Let’s take back our cities tomorrow. 
Enough is enough."
12,It’s good to know Democrats still have job options after tomorrow! https://t.co/yjLk5Bwdub
13,Yes. This times 1000! https://t.co/ycLJPHsL7C
14,Vote to bring safety back to our cities!!!
15,"The democrat and media machines went all to coverup the obvious cognitive issues of a potential senator. Everyone knew, and knew early when they could still make a change, but they were more than happy to lie to the people of PA to get what they wanted… as usual!"
16,"Great OpEd from @RepMikeRogersAL and @RepJimBanks on their plan to get tough on China!

Washington Examiner: House Republicans are committed to strengthening our military against China

https://t.co/I88m8Qcu7a"
17,We did it Joe!!! If you think that this is the last of the shortages you haven’t been watching this is just the start and it’s all because of democrat policy. Vote Them Out! https://t.co/BGVNrAfBYo
18,"Most ""journalists"" today don't even bother trying to hide their leftwing agenda. The Patriot Post is your daily guide to all the news they don't want you to see. Sign up for the Patriot Post's newsletter here now! https://t.co/W98Tk7hsUm"
19,True… if we had actual media and not simply leftist activists. I hope we teach them a lesson at the polls on Tuesday.
20,"America, on Tuesday vote like your lives, your safety, your livelihoods and those of your children and grandchildren are in the line…
BECAUSE THEY ALL ARE and it’s clear that democrats and their policies couldn’t care less. 
Vote out Democrat insanity. Vote in common sense!"
21,Hey New York. You can do something about this on Tuesday! I talk to everyone I know there &amp; they all feel the exact same way. Why would anyone keep giving people that keep pushing failed/insane policies more opportunities to continue their failures? Enough!https://t.co/tIWAGFWBZO
22,"I remember my first time shooting.

Just like everything else that you’re faking and pretending to be… if you or anyone on your team knew anything about shooting, firearms, or the second amendment they wouldn’t have let you post this video."
23,The perfect metaphor for Fetterman's campaign
24,https://t.co/soMrKh8LUl
25,Hey Twitter ex employees… Found some jobs for ya. https://t.co/PYZTdWRNA4
26,"The Twitter layoffs are kinda hilarious, and under these circumstances I’d normally want to tweet out “learn to code” but feel it won’t hit the same.
😉"
27,"The democrats all think you’re stupid. They think you don’t see what’s happening at the pump or on your grocery store shelves. They’ll lie to you incessantly to sell their leftist narrative thinking you’ll take the bait. Stop voting for democrats, they hate you and our country."
28,YUGE!!!
29,"Dear women. Remember that the idiots on The View called you “cockroaches for voting for raid” because you’d have the audacity to vote for republicans to bring back Safety to our cities, law and order, our economy, end school lockdowns, not have 3 y/os deciding their genders etc…"
30,"Wow, Ohio here’s like example 2 Billion of Tim Ryan lying to you to get elected as a pretend moderate when, in fact, behind closed doors &amp; in voting record he’s nothing more than a radical Pelosi Democrat who voted 100% of the time with the Biden/Pelosi agenda that screwed Ohio!"
31,Hey Ohio pay attention to what phony moderate Tim Ryan does not the bs the Dem media tells you. #ohio #oh #ohsen
32,"Ohio, Tim Ryan isn’t a moderate he’s just willing to lie to you you to get elected. Here’s yet another example. 
He’s a radical dem and will continue to function that way if you send him to DC! #ohsen"
33,"Joe Biden falsely smears anyone who opposes his radical leftwing agenda as an enemy of democracy. 

What a disgrace!"
34,"You have to hand it to the Democrats, just when you think it's impossible for them to get any dumber, they manage to outdo themselves!"
35,"This his what happens when you give democrats power. They really believe this insanity is somehow right and it’s become their religion. 
Don’t ever vote for them again! Vote like your lives and your children’s innocence and safety are on the ballot… BECAUSE THEY ARE!!!"
36,"Clarence Thomas' thoughts on affirmative action cases

I found this article on MxM News--a new app without media bias or censorship.

https://t.co/wDvOaBdXPi"
37,For the price of an AOC sweatshirt you can watch Elon Musk destroy her for more than 7 months… much better value TBH.
38,"AOC turned away Amazon and 25k + jobs from her district because she couldn’t grasp the basic concept of tax breaks/incentives.

I’m certain she shouldn’t be handing out financial advice to anyone let alone Elon Musk."
39,"Ohio, shockingly this DC hack who votes 100% of the time with Biden &amp; Pelosi isn’t the moderate Dems &amp; the media are telling you he is. As usual they’re lying to you to get their lap dog Tim Ryan into office then he’ll go back to obediently serving their radical extremist agenda."
40,OMG the BS never ends.
41,"If you’re a non-woke patriotic consumer or business owner, hit the retweet button and sign up for PublicSq today at the below link. 

We are building the red state economy one patriot at a time. This is our way of fighting back against woke culture. https://t.co/HQQLuGBdHo"
42,"Dear Pennsylvania voters it’s not ableist, racist, or any other ist the media will try to call you to expect your senators to have basic cognitive function. John Fetterman clearly doesn’t have that."
43,The choice is simple: McMuffin is a leftwing Democrat pretending to be an independent to get elected. He will support Biden's radical agenda 100%. Mike Lee is a strong conservative who we can count on to push back against Biden's leftwing policies. He will always put Utah first!
44,Fetterman is a disaster! https://t.co/GrWUFDPmhT
45,"And some still question if fake news exists. The BBC just admitted it created fake profiles across social media…  

BBC tries to understand politics by creating fake Americans  https://t.co/MEjbG4jTH5"
46,Tim Ryan exposed as a liberal fraud again
47,"And the media has spent the last 6 months lying to Ohioans claiming this radical is a ""moderate."" 

Daily Wire: Tim Ryan Pledged In 2019 To Defund ICE, Support Citizenship For Millions Of Illegal Immigrants

https://t.co/z5FN0d2IuL"
48,"We desperately need more fighters like Blake Masters in the US Senate!

https://t.co/TwGh0OzE7L"
49,The media really think people are stupid enough to believe that Fetterman is physically/mentally capable of serving as a US Senator.
50,"Wait, so you’re saying if we actually enforced our immigration laws in California, Paul Pelosi’s attacker wouldn’t have been here to commit the offense! 
Good to know."
51,"Meanwhile, over on the taxpayer funded “news” outlet"
52,Ban all hammers… https://t.co/VBr8Mfoa85
53,The internet remains undefeated… Also if you switch out the hammer for a red feather boa you could be Hunter Biden in an instant.
54,Are those eviction notices in your hand?
55,Imagine how safe the country would be if democrats took all violent crime as seriously as they’re taking the Paul Pelosi situation. They simply don’t care about you.
56,"I feel about as much sympathy for the laid off Twitter employees as they did for the people whose opinions and even livelihoods they suppressed. 
Exactly Zero. Don’t worry, they’ll go to some other big tech firm and be back suppressing anything but the Dem talking points soon."
57,"Project Veritas has been exposing Twitter’s bias and censorship for years @ElonMusk!

Bring them back on Twitter!

https://t.co/i9NshDiwM1"
58,"Democrats failed to “pack the court,"" so now they're trying to put term limits on Supreme Court Justices so they can replace conservative judges with radical liberals. Join The First Liberty’s coalition to stop progressives' takeover of the Court here now! https://t.co/lkVFr3GOj1"
59,I think we have a best seller!!! https://t.co/u4KDHJDrRB
60,Strange that I haven’t seen any fact checks on this flagrant Biden lie anywhere… it’s almost like the fact checkers are just partisan hacks and not actually checking for facts?!? https://t.co/I3CuaqUhoa
61,Strange that I haven’t seen any fact checks on this flagrant Biden lie anywhere… it’s almost like the fact checkers are just partisan hacks and not actually checking for facts?!? https://t.co/R9BDNe4lZH
62,I remember when this obvious conclusion would get you banned from social media. It was always the most plausible solution but one that couldn’t be weaponized against Trump so it was rejected by imbecile tyrants. Don’t forget that.
63,He’s not wrong. NY pay attention. It’s up to you!!!
64,Who did it better: Howard Dean or John Fetterman? https://t.co/KZ7QH9YO8T
65,Anyone who’s been watching knew this was coming stop giving these tyrants your hard earned dollars as they will only be weaponized against you. Go to https://t.co/HQQLuGBdHo find companies that share your values &amp; spend your hard earned dollars with people who share your values! https://t.co/t4952MraKm
66,Dear leftist Twitter it is not “ableism” to expect a potential United States senator to be able to form a complete thought and/or sentence. Which John Fetterman clearly could not do! That’s the most basic part of the job and if he can’t do it he doesn’t belong there. #PASen
67,"That’s weird he’s been telling us all week that he is fine and well… What is he hiding? However, based on tonight’s performance he’s clearly hiding a lot from the great people of Pennsylvania!"
68,"Watch this clip and then think about all the members of the media who spent the last 4 months lecturing us about how ""healthy"" John Fetterman supposedly is.

Enemy of the people."
69,YIKES! This poll from the network that moderated the Pennsylvania Senate debate.
70,"Dear leftists, I see that many of you were offended by my Fetterman comments, calling me an “ableist.” After thinking about it, I’d like to apologize … for absolutely nothing. I expect potential senators to be able to form complete thoughts and/or sentences. You idiots. #PASen"
71,The 18% only slightly less mentally impaired than Fetterman.
72,Politico running rapid response per usual for the democrat.
73,Re-upping this…
74,"Clearly not well… Also, Joe Biden told the people of Pennsylvania that he supported fracking and then on day 1 signed an executive order ending major pipelines you can’t trust anything Democrats tell you. 
They say what they need to say to win and then they’ll do the opposite!"
75,OMG John Fetterman it’s worse than any of us could have ever imagined. At this point the moderator is filibustering to make sure he doesn’t get any more Qs. I think that’s 4 in a row to @DrOz. Even today’s partisan hack media can’t cover for Fetterman being brain dead! #PASen
76,"If you’re from New York State tune in to the @leezeldin Kathy Hochul gubernatorial debate and see for yourself why you clearly can’t vote democrat this year. 
Listen to how out of touch she is and how little she cares about the things that matter to you and your family."
77,Pretty obvious why Fetterman refuses to release his full medical records!
78,"Holy shit, Fetterman is fried."
79,John Fetterman is not well. Pass it on.
80,"So Mark Kelly’s strategy to win in Arizona is to lie to his voters. Be whatever you need to be to keep power and then go back to following the lunatic leftist line. Ok got it!
Arizona vote for @bgmasters and have someone who will fight for you not lie to you."
81,"The same morons how blew the Afghan withdrawal are the ones who think they should be in charge of the escalating nuclear crisis with Russia.
What could go wrong?

If you want to stop a nuclear war and more endless wars… vote out all the Dems on Nov 8th!"
82,The entitlement in that letter and the tone from people with little to no leverage (who were beyond rude vicious towards their soon to be new boss for months) are truly something and indicative of so many issues our country will have to face as younger generations get older.
83,"Radical liberals are using woke cancel culture to de-platform &amp; de-monetize Patriots across the country.

These evil actions hurt patriotic Americans businesses &amp; their families.

Join PublicSq to support non-woke small business owners across the nation! https://t.co/HQQLuGBdHo"
84,Quick send in DOCTOR Jill Biden to call them TACOs and they’ll really be able to keep the fake virtue signaling and asinine pretend racism that make up the entirety of the Dem platform going.. clearly a winning strategy. 🙄
85,"Huh… No shit??? Who could have possibly seen this coming? Next we will find out being obese and out of shape could be harmful to you and is not in fact healthy like they’ve been telling us?
Trust the science!!! https://t.co/azECuL27zv"
86,When the Republicans take The House this better be on the top of their list of things to fix. Democrats would put people in jail for this level of election interference and in kind financial contribution if it went the other way and benefited republicans. Where is the FEC?
87,"Parents are you watching? This is where the democrat party is today. Forced vaccinations, no law enforcement (except those weaponized against their political enemies) open borders, crime, war with Russia, a failing economy/energy sector etc. 
You can stop this madness on Nov 8th!"
88,"The democrat party in a nutshell. In a country of aprox 350,000,000 people, a middle aged biological male who transitioned to female about a year ago is the person chosen to go to the Oval Office to talk with the President about being a girl.
That’s who they think is the best fit"
89,Ted absolutely crushed the clowns over at The View
90,Yikes!
91,"Devastating what has happened to New York. If you are pissed about crime and the economy, Hochul is to blame and Zeldin is your alternative. Act like your safety, livelihoods and your family’s well being are on the table… BECAUSE THEY ARE!"
92,"It was bad enough that RINO Tom Emmer had his henchmen attack Tucker Carlson's 25 year old son to the Daily Beast, but now Emmer is trying to throw the staff of another member of Congress under the bus to cover his own ass???

What a pathetic coward. https://t.co/mD0O2WFNr0"
93,"Weak RINOs who support this type of woke social justice bullshit don't belong anywhere close to House GOP Leadership. Drain the swamp!

Daily Caller: Republicans Tear Into One Of Their Leaders For Requesting ‘Social Justice’ Highway Money From Buttigieg

https://t.co/otgixQdSO2"
94,Imagine the level of insanity/depravity in the 42% of Democrats who think the teachers union will do a better job than family influencing their child’s education!!!
95,Perfection https://t.co/Ur1DFO1zkX
96,"Why did Tom Emmer tell his consultants to run to the leftwing Daily Beast to trash Jim Banks, Tucker Carlson and Tucker's family? Does he really think that’s a winning strategy for a Republican House leadership race? Pathetic! https://t.co/kFwi1C5M1P"
97,This is what John Fetterman supports. He has blood on his hands!!!
98,It’s as if they’re trying to make sure people don’t do even the most basic vaccinations. It’s truly hard to even think of these people as serious given all we know about children and COVID and all we don’t know about long term effects. WTF!!!
99,So now with 20 days to an election she’s worried about crime for the first time in her term??? Got it. This logic is why NY has turned to shit.
100,Yikes!
101,WTF is wrong with this guy???
102,Dear everyone who hasn’t lost their minds. You can vote against this insanity on November 8th. Remember it and show up. If you don’t it’s only going to get a lot worse.
103,"Biden's covid vaccine mandate for the military is a disgrace!

https://t.co/Uj7BGiDfZg"
104,If Fetterman is some sort of leftist decoy to make Biden actually sound somewhat intelligent and articulate he’s doing a great job.
105,"If you’re a freedom loving American that wants to fight back against woke corporation’s and woke culture, you need to sign up PublicSq today. 

Non-woke businesses and consumers sign up at https://t.co/HQQLuGTmVw 

Take a second to support patriots rather than those who hate you!"
106,"Yikes! Turns out that the cops aren't fans of leftwing radicals like Sisolak, who bent the knee to BLM and caused violent crime in Nevada to skyrocket."
107,Checks out https://t.co/W3ZtwkLcnj
108,JD Vance just ended Tim Ryan’s political career. https://t.co/TgUZCDfIsX
109,Tim Ryan just got exposed
110,"The Average American family has now lost $6,000 in annual wages under Biden due to inflation. Remember that on November 8th. You can make that stop or you can make it worse by letting democrats continue their insanity."
111,"From the same lying hacks who brought you ""inflation is transitory."""
112,Narrator: They will never be Fact Checked
113,"Fight back against woke corporations. 

Support patriotic businesses that share your values by signing up at https://t.co/Qotm0ehdKx 

Non-woke patriotic consumers and businesses are free to join. 

Retweet if you’re non-woke and to spread the word.🇺🇸🇺🇸🇺🇸"
114,A “conspiracy theorist” these days is simply someone who is capable of obvious pattern recognition.
115,So Nancy Pelosi refuses Trump’s request for a national guard presence on Jan 6 &amp; simultaneously has a documentary film crew in her office where are you can hear her poorly delivered tough guy act… I’m sure I’ll be called conspiracy theorist for thinking this isn’t a coincidence!
116,In Joe Biden’s America it’s easier to find Fentanyl than it is prescription drugs like Adderall…
117,"I was under the impression that far less than this is an impeachable offense…

WH cops to pushing Saudis to postpone oil cuts until after midterms

I found this article on MxM News--a new app without media bias or censorship.

https://t.co/uGQf4o91CZ"
118,"Imagine what would happen if conservative called for consequences for a reporter for stating the obvious? They think it’s fine to hide from the people of Pennsylvania that a potential senator was in capable of holding even a basic conversation? 
That’s Liber Privilege! #pasen https://t.co/0p0ajOoBsR"
119,"The radical left is purging thousands of conservative accounts weeks before the elections.

If you see this tweet, hit retweet and click the link below to join hundreds of thousands of patriotic Americans. 

Together we will build the red state economy. https://t.co/HQQLuGBdHo"
120,"I was told far less than this was impeachable? Why the silence from the media? 

WH cops to pushing Saudis to postpone oil cuts until after midterms

I found this article on MxM News--a new app without media bias or censorship.

https://t.co/uGQf4nQSoR"
121,"Americans are getting crushed and it’s only going to get worse and this guy is demanding billions upon billions for his country to of course be paid almost entirely by the US. We are +/- $75,000,000,000 in the hole already &amp; he probably hasn’t even started.
ENOUGH OF THE INSANITY"
122,"Woke banks and other institutions have been cancelling people for constitutionally-protected speech for the last few years and it keeps getting worse.

It’s time to ditch the woke banks and find a freedom-loving bank that will respect your 1st amendment at https://t.co/JFfFexGahz"
123,"As long as pro-crime Biden lackey Catherine Cortez Masto is in power, every family in Nevada is less safe. #NVSen https://t.co/aAa6FIZ5Ta"
124,This is something the press is supposed to ask but since they’re too busy campaigning for democrats of course they won’t.
125,When Republicans take over the house I hope they investigate this fully. It’s big tech was doing this for Republicans the Democrats would put them all in jail.
126,Holy shit this is so corrupt! WTF
127,"Two months ago: Democrats passed the “INFLATION REDUCTION ACT.”

Today: Inflation surges and rises to a 40-year high."
128,Don’t rule out BOTH!
129,If we actually had journalists they’d point out that this is a big problem for someone who is supposed to be in charge of the free world. Unfortunately we don’t.
130,Google approves Trump's Truth Social for distribution in Google Play | Fox Business https://t.co/BYGztB4wsh
131,BREAKING: Tim Ryan calls to eliminate cash bail nationwide #OHSen https://t.co/lAgKybU9aD
132,"Come on Pennsylvania you can do so much better than this. Can anyone say with a straight face that this man is fit for office? Elect someone who can help fix your economy, end crime (not create more of it) and bring back your jobs! Enough of the insanity!  https://t.co/QW49fnhakL"
133,What else is going on with his brain besides what we see daily? The fact that he needs closed captioning to do a face to face with a friendly reporter indicates there’s a lot more wrong with him than we’re told &amp; of course the MSM will do what they can to carry him over the line!
134,"Tim Ryan is a 20 year career politician, who votes with Biden and Pelosi 100% of the time. In other words, he's a complete fraud! #OHSen"
135,This guys brain is totally fried
136,"And Fake Tapper is such a hack that instead of asking Biden why he has note cards or what's in them, he immediately hands them right back over to him with no questions asked. Don't let anyone fool you into thinking that Tapper is a journalist, he's a lifelong Dem activist."
137,What a disgrace
138,Must watch new ad in #NVSen calling out Biden rubber-stamp Catherine Cortez Masto for voting to hire 87k new IRS agents to terrorize hardworking Americans!
139,"EXCLUSIVE: Republican challenger in Nevada accuses Sen. Catherine Cortez Masto of UNDERMINING Hunter Biden investigation in new ad because she 'took his foreign money' and her husband asked him for security contracts

https://t.co/rdQsA25plj"
140,Yikes!!!
141,Career politician @TimRyan thinks he deserves a medal for spending 20 years living off the taxpayers making 175k per year &amp; working less than 4 days a week...while the district he was elected to represent in Youngstown lost thousands of jobs to China. What a POS! #OHSenDebate
142,"Holy shit, @JDVance1 just KO'd Tim Ryan!!!

""You voted so many times against border wall funding...If you had done your job, she would have never been raped in the first place. Do your job on border security, don't lecture me about opinions I don't actually have.""  #OHSenDebate https://t.co/MzDLevzKeI"
143,Tim Ryan couldn't go one answer without lying thru his teeth. #OHSenDebate
144,"Fight back against woke corporations like PayPal today. Enough is enough!

Patriotic businesses and consumers should sign up at https://t.co/JFfFexp7fz. 

Let’s get the app to #1 on the App Store. We can do this. Tell your friends and family too. 🇺🇸🇺🇸🇺🇸"
145,"I’m proud to endorse my friend @JeffLandry for Governor. Jeff is a strong conservative, who will take on out-of-control crime, fix broken schools &amp; bring common sense back to Louisiana. He will make Louisiana great again!!! #lagov

https://t.co/OCIXwxpNiX"
146,"Ohio you can do so much better than this clown. Not only has he voted with Biden &amp; Nancy Pelosi 100% of the time, but he’s taking $ from the opioid hustlers. 

Tim Ryan Took Money From Opioid Distributor Whose Executives Mocked Addicts as ‘Pillbillies’ https://t.co/xDiSYDGkQO"
147,"Fauci just gave another payout to EcoHealth Alliance – the group of mad ‘scientists’ that funneled tax $ to the Wuhan Lab for animal experiments. Demand Congress defund EcoHealth here now!!!
https://t.co/tZWWFhUUYJ"
148,Strange how many people on here who lost their minds if someone didn’t want to wear an ineffective face diaper seem to be pretty nonchalant about nuclear war.
149,"Maybe PayPal should Fine itself $2500 for pushing a lie? Stop giving these companies your hard earned money! THEY HATE YOU!!!

PayPal Reverses Course, Says Company Will Not Seize Money From People for Promoting ‘Misinformation’ https://t.co/KxRhtLREDO"
