,tweet
465,"So you can have actual cigarettes but the healthier alternative is banned? 
I guess the vape folks didn’t bribe the swamp as much as big tobacco???
So stupid."
466,Good for him. More of this!
467,"With weak ""Republican leaders"" in the Senate selling us out like this, who needs Democrats?"
468,Totally not a violation of Twitter’s TOS.
469,Yet another one where Trump was right despite the snickering of these incompetent bureaucrats. Sure would be nice if people in government had a basic understanding of the world and their jobs.
470,"Nothing says really really ridiculously serious like photo-ops with Hollywood celebs. Did we guarantee a lot of these as part of the $53,000,000,000.00+ aid package? https://t.co/OD4kVuIlf7"
471,How long till they eat these words?
472,He needs his photo-op too!
473,"Which is worse, the topic or the fact that they feel they need to talk to service members like children? We’re going to lose/keep losing major conflicts if this continues…"
474,Happy Father’s Day https://t.co/VHrc4Xk9ER
475,We have no Baby formula but we’ve got COVID shots for babies. The first country in the world. What could possibly go wrong? #ShotsForTots
476,We have a winner folks!!! https://t.co/DA0C5vNJQj
477,I’m not sure there’s ever been a more perfect metaphor for the current state of our country than Biden falling off his bike while standing still for literally no reason. https://t.co/4ByBOHJdEa
478,How long till they blame Putin?
479,I’m just shocked they let him ride a bike without training wheels.
480,If you think the Karens were bad with masks… imagine what these people would do with Red Flag Laws!🚩🚩🚩 https://t.co/RwFmO4dgLS
481,"If half the country is a “threat” and Crooked Hillary and the gang get their Red Flag laws, does anyone seriously think they won’t weaponize them to confiscate guns from innocent, patriotic Americans?"
482,The same people that called you a racist fascist nazi for being a conservative for the last 5 years definitely won’t call you crazy to weaponize Red Flag Laws to effectively end the Second Amendment. 🚩🚩🚩
483,Imagine what Amber Heard would have done with Red Flag Laws!
484,Here’s how Red Flag Laws would actually work. If you’ve been watching for the last two years you know this is exactly how the radical left would weaponize these “laws” against law abiding Americans. https://t.co/LQI5U562HC
485,"Thanks for this helpful graphic, which perfectly illustrates why red flag laws are incompatible with due process rights &amp; would ultimately lead to a leftwing police state.

Any ""Republican"" selling out to the left to support this trash, might as well put a (D) next to their name."
486,Epic! Must watch https://t.co/2WYR7znwZN
487,If he was willing to say these things in videos and on tape imagine how much worse the things he didn’t record are? I’m sure the Russians and Ukrainians aren’t using that against Joe to influence our policy while in the brink of WW3. Media won’t even ask about it.
488,"Ohio, meet the real Tim Ryan. 

A flip-flopping, anti-police, pro-BLM leftist, who votes with Joe Biden 100% of the time, Pelosi 100% of the time and AOC 95% of the time. #OHSen"
489,"So the science™️ says we know where a pandemic in the 1300s came from but the science™️ is also perplexed by a bat coronavirus emerging from a Chinese town with a bat coronavirus lab. Makes sense. 

Origins of the Black Death identified https://t.co/yiekkkfxMg"
490,“A Drag Queen for every school” is a great summation of today’s Democrat Party Platform.
491,"Breaking News: Anthony Fauci has COVID 

He's octuple vaccinated and quadruple masked, and yet the 'rona still found a way. SCIENCE!"
492,"Yikes!!!

We already knew that Two-Faced Tim Ryan was a flip-flopping fraud, but now he's been exposed as a leftwing anti-police radical."
493,Happy Birthday Dad! https://t.co/DKfoNMQ3cW
494,"Radical leftists are indoctrinating American children, pushing Critical Race Theory in schools. School boards attack &amp; even arrest parents who push back. Don’t let this crap will be in our schools! Demand CRT be removed from schools here now ⬇️⬇️⬇️ https://t.co/ldbmK7yEJb"
495,Trump Jr. Rallies for Adam Laxalt in Las Vegas Ahead of Tuesday Primary - Nevada Globe https://t.co/PK0iqgcDro
496,Almost like it’s just political theater 🤔🙃
497,Liz Cheney should be investigated over how she has openly used this sham of a committee to target and harass her political enemies
498,"Radical leftists are seeking to indoctrinate American children, pushing Critical Race Theory in schools. School boards attack &amp; even arrest parents who push back. Don’t let this crap will be in our schools! Demand CRT be removed from schools here now⬇️⬇️⬇️
https://t.co/ldbmK7yEJb"
499,Haters will say it’s fake.
500,"Paul Pelosi charges weren’t dropped. They’re just “under review”

Just wait for it: https://t.co/3utfa7SmaK"
501,Looking for the perfect Father’s Day gift for the Ultra MAGA dad in your life? Look no further!!! https://t.co/iM9kfkB1t5
502,The only cure for this is more J6 committee hearings. https://t.co/UZjPY3SbGS
503,Same clowns that dubbed Al Qaeda leader Al-Baghdadi “an austere religious scholar”
504,Ohio take a close look at Tim Ryan’s record ⬇️ and you’ll understand why he has failed and will continue to fail you. @JDVance1 is the only way to fix things.
505,"Democrats are putting on yet another partisan show trial to distract from what’s really happening in America. And anyone who’s been to a store realizes the number is significantly higher.

WASHINGTON (AP) — US inflation hit 8.6% over the past year, highest rate in 4 decades."
506,This is what’s really going on in America and the Democrats want to distract you with their sham partisan bullshit. Oh yeah and apparently Russia Russia Russia is making a come back too🙄 Give me a break! Democrats hate America and they hate you! https://t.co/yKX3dPirsB
507,Here we go again folks🤡🤡🤡 https://t.co/fuHG31SJAy
508,"Come see us tomorrow in Nevada. RSVP to both events below!!!

RSVP for Carson City: https://t.co/bHLHSLgu6r

RSVP for Las Vegas: https://t.co/ZMBIn2LmE9"
509,"Don Jr., Richard Grenell to Campaign with Joe Lombardo, Adam Laxalt in Nevada

https://t.co/vZ151XeQCs"
510,Let’s make this piece of shit famous folks. The media won’t report the truth on this so let’s make sure decent people call out this crap.
511,"Yikes!

""Cheney is trailing her leading GOP primary rival, attorney Harriet Hageman by 28-56 percent...When Hageman first got in the race, she led by 8 points. Now she's ahead by 28 points""

Cheney's Jan. 6 committee spotlight burns her in Wyoming primary

https://t.co/I0c3WFxW4F"
512,Serious question. Did anyone really believe that Paul Pelosi would face any consequence at all for his DUI crash? Anyone who’s been paying attention knows that the rules don’t apply to Dems they just want you to abide by what they say not what they do. Recurring theme!
513,"As I was saying!!! It’s just too obvious and predictable these days. They don’t have to play by their rules only you do folks. Hope you’re all waking up!!!

BREAKING: All charges have reportedly been dropped against Paul Pelosi for his DUI crash."
514,Of course they won’t release the footage. Releasing it will make it so much harder on them when they inevitably get pressured into dropping the charges. If they don’t drop them budgets will be cut promotions passed over etc. Don’t you know how this works yet?
515,"Can you think of something more Cheney than this??? I mean other than shooting your friend in the face with a shotgun of course!!! WY can do so much better. 

Liz Cheney Tries To Extract Campaign Cash From Subpoenaed J6 Witness https://t.co/67bEE1eYfq"
516,Biden Is Actually BRAGGING About His Terrible Economy... How Nuts Is He? My thoughts below.  https://t.co/KkNxAllLzX
517,Guys let’s make sure that we don’t let the anniversary of D-Day overshadow 1/30th of Pride Month🏳️‍🌈🏳️‍🌈🏳️‍🌈 https://t.co/9ElPM2o0Ux
518,"It’s fun to watch the MSM eat their own, but also here’s some unsolicited advice: Get a sense of humor, you schmucks. 

That being said, we need a full audit of WaPo's oppressive practices! Toxic workplace? Gender pay gap? Independent investigation!  https://t.co/KQD1LQvk5C"
519,Yes!!! This times 1000
520,"So disappointing to watch a supposed Republican desperately echo the dishonest smears of the leftwing media to try to tear down @bgmasters. 

Borrowing a page from the corrupt Democrat playbook to lie about a fellow Republican won't save your campaign, @jim_lamon...Shameful!"
521,I’d pay good money to have VP Giggles explain this. https://t.co/Njfuc8FEKH
522,Hurry up before it’s too late and sign up and meet your favorite president guys!!! https://t.co/DN7Nh1XG6t
523,Thread worth reading.
524,"Proud to join my father in endorsing my friend Blake Masters for US Senate in Arizona!

The Senate GOP is desperately in need of some generational change and between @bgmasters, @JDVance1 &amp; a few others, the MAGA movement has an opportunity to reshape our party for the better!!!"
525,Don’t forget to sign up and meet your favorite president folks!!! https://t.co/DN7Nh1XG6t
526,"Don’t worry libs Michael Avenatti’s presidential run isn’t over, it’s just been delayed by four years or so."
527,Happy Michael Avenatti Sentencing Day!
528,"I guess the short burst of freedom and equality for conservatives on @Twitter  after the @elonmusk announcement was short lived. It was a fun 10 days though with an almost level playing field. 
New Twitter same as the old Twitter. https://t.co/E9oQ9ZwuIG"
529,"Believe all women... except Amber Heard.

$15,000,000 in compensatory and punitive damages to Depp, and perhaps a case that could end the effective rabid femminist notion that all men are guilty before being proven innocent that we've seen as of late. 

She's just that terrible!"
530,But we were all told… never mind. We all know.
531,Enter now to get a chance to meet your favorite president!!! https://t.co/DN7Nh1XG6t
532,"I imagine this DC juror would not feel the same way if it was me lying to the FBI instead of Clinton’s lawyer. 

Juror Who Acquitted Sussmann: 'There Are Bigger Things' Than Lying to FBI https://t.co/V2HJjZgn5k"
533,"Because words have no meaning, and even if they did you could just identify as something else anyway!

Trust The Science! The Science: Bees are Fish"
534,Get ready folks!!! https://t.co/kFKo5g0Fbn
535,"Definitely not grooming... there's an academic and likely event a scientific need for doing this to our kids. 
Trust the science!!!"
536,Breaking: Clinton lawyer Michael Sussman found not guilty by Clinton Donor DC jury. Shocking🙄 My thoughts below. https://t.co/IcgnzvCFAx
537,"I'm shocked the DC Clinton donor jury let Clinton's lawyer off... HAHAHA just kidding, absolutely no one is shocked. Hunter Biden off next then Paul Pelosi etc etc. We all know how this goes by now... Only people not tied to the establishment DC swamp ever face accountability."
538,“We only want to ban AR-15s” claim the American libs celebrating Trudeau for banning handguns.
539,No shit?!? Who could have possibly seen this coming?
540,"It’s hard to imagine any scenario whereby this kind of study from these people is anything but nefarious at this point. The assault on our kids never ends. WTF!!! 

UNICEF Report Says Pornography Not Always Harmful to Children

https://t.co/bd306n805L"
541,"I have an idea. Get rid of one or two of your gender studies or critical race theory “teachers” and replace them with an armed guard. Let parents vote on that!!! 

Republicans need to get smart people getting ballot initiatives like this everywhere!"
542,I was told the Ukrainians were kicking their asses? Wait was that all just a lie to push a political and emotional narrative? How much more needless and senseless death occurred because of it?
543,"“Republican” @RepJacobs already caved to the gun-grabbers whose proposals won’t do a single thing to protect our families &amp; children from criminals &amp; murderers. He knows this but he can’t resist getting a few glowing headlines from the mainstream media. 
 https://t.co/umyIlr8MtZ"
544,Where’s the lie???
545,Maybe the most telling part of the Amber Turd trial is that not a single man seems to have come out in her defense saying she’s great.
546,"We’re not supposed to judge this F-ing piece of shit who killed 19 kids? He had his reasons??? F You!!! 
This is so much of the problem in our society. There’s always a fucking excuse and zero accountability and we’re not allowed to say anything about it. https://t.co/M1QjoMlo9F"
547,"BREAKING: Nancy Pelosi's favorite RINO Liz Cheney just filed to run for reelection in Wyoming. 

DONATE below to Trump-endorsed @HagemanforWY to defeat Cheney!

https://t.co/RBZjklvOn8"
548,You had it right the first time. https://t.co/4zx3Jq4GXU
549,"Da-Nang Dick at it again folks. 

Blumenthal Voted for Intel Subsidy After His Family Bought $250K in Stock https://t.co/wjszfwL800"
550,"You guys watching what they do to those who step out of line? Gates poured millions into dark money fund attacking Elon Musk

https://t.co/CHtMERlJbG

I found this article on MxM News--a new app without media bias or censorship. Download it here: https://t.co/GsEyGqpJZ7"
551,"Great, let’s start by hooking everyone in attendance at the world economic forum up first. Once we get an understanding of a baseline of their G5s, numerous huge homes etc…. of the people who would push this crap on us then we will make sure to live within those standards."
552,I’m having the same problem. Just screaming “trust the science” doesn’t seem to fix the issue. https://t.co/RFVmZ2kyds
553,I guess the Davos globalists don't believe in freedom of the press!
554,"Is anyone really surprised by the Democrats desperately resorting to dirty tricks like this??? 

Democrats Interfere in Nevada GOP Gubernatorial Primary in Attempt to Stop Trump-Backed Joe Lombardo

https://t.co/Mh2qpyEVkX"
555,How long till the WHO and CDC lock us down again for the coming #Monkeypoxalypse?
556,The only good thing the Biden Administration has accomplished is they finally made it impossible for his supporters to afford gas for their Molotov Cocktails.
557,"Remember when @JohnRatcliffe declassified intelligence about @HillaryClinton being behind the Russia, Russia, Russia 😱 smears against Trump &amp; the media rushed to call it “disinformation”? 

Now Crooked’s own campaign manager admits in court she was behind it all.

Whoops! https://t.co/2qoACR9PNR"
558,Welcome to the club Elon. https://t.co/KBSC0CkZeu
559,We never had a baby formula shortage until men started getting pregnant!!! https://t.co/0baseNBLB7
560,"This is a step too far. We put up with gas doubling, interest rates rising, war in Europe and all the rest of the Democrat’s incompetence, but I’m drawing the line at wings!!!"
561,Hardest hit: All the republicans that AOC wants you to believe are chasing a date with her by ridiculing her. Tough day for those guys. https://t.co/BUHIOrB5kW
562,"Nah. ⁦@RandPaul⁩ is 100% right. America gets it too, especially when they figure out where it’s really all going. Our tax payer money should be invested in America. Not Ukraine &amp; not given to Big War! #AmericaFirst  https://t.co/Z6j3UnGZUT"
563,"I wish he would have been this honest and critical of himself 20 years, countless lives, and trillions of dollars ago. https://t.co/d8nhcZ981d"
564,"I’m sure all his voters are legit though. 

Half of Joe Biden's Twitter Followers Are Fake, Audit Reveals https://t.co/Hsi7vgAJsZ"
565,"""The party of science"""
566,Flagging for you @IvankaTrump
567,"BREAKING: @Twitter Lead Client Partner Says Woke “Ideology” Responsible For Inability to “Profit”; Affirms Twitter Not Here “To Give People Free Speech”; Refuses Taking @ElonMusk “Seriously” Due to “Asperger’s” Making Him “Special”

#TwitterExposed https://t.co/LmZMRWvdwW"
568,"I've seen the media do some gross things over the years, but it doesn't get more vile than @sppeoples of the @AP falsely smearing someone who is literally married to an Indian woman &amp; is the father of 3 biracial kids as endorsing ""white replacement theory.""

What a piece of shit."
569,⬛️⬛️⬛️
570,While we’re banning stuff we should really ban Congressthey/thems from sleeping with Chinese spies.
571,"Judging by the speed and volume of replies to my tweets (many faster than someone could read my tweet, formulate a response and type it with all of them being totally off topic as well) there’s literally ZERO % chance that Twitter is less than 5% Bots."
572,"Definitely not a scam.🙄 I hope your black square virtue signaling and posted receipts went to buying someone else a luxury home and cars. 
🤡⬛️🤡⬛️🤡⬛️🤡 https://t.co/OPrU1zpIaS"
573,"Yikes! Twitter Senior Engineer says “Twitter Does Not Believe in Free Speech”, admits employees are “Commie as F**k”and they tried to “revolt against” @ElonMusk’s takeover bid.

#TwitterExposed https://t.co/z6hMVK7P83"
574,"It’s amazing how fast the Waukesha radicle racist extremist disappeared from the news cycle and magically became a car. It would be nice to despise all racism, but unfortunately that won’t happen."
575,🧐
576,"Jim Bognet is a great America First Patriot running for Congress in Scranton, PA. 

He is a strong MAGA fighter who we can trust to take on the DC swamp. That's why my father and I are both supporting him. 

Northeast Pennsylvania: get out and vote for @Bognet4Congress today!"
577,WTF
578,"As if we needed another reason to want Trump to run!
https://t.co/51iAcFuGXy"
579,I remember when saying this got you labeled a conspiracy theorist. It was always obvious but science and such.
580,"I get there’s nothing going on at home that Congress could be worrying about, but after decades of not being in NATO and being just fine isn’t the notion of eliminating this buffer zone a little bit how the Ukraine invasion started?"
581,True https://t.co/WQOwqaFKgV
582,Truly one of the greatest orators of all time.
583,@iamLisaHunt Zer/Zin
584,"My new pronouns are: The Great MAGA Prince!!!

If you don’t abide by that you’re committing literal violence."
585,The killer attacks Fox News in his manifesto. CNN is paying a guy to lie and politicize the deaths of 10 people while their bodies are still warm.
586,Rather than spend $40 Billion of American taxpayer dollars to fund DC’s proxy war with Russia why doesn’t Zelensky just charge these politicians for the obligatory selfie and fund it himself??? https://t.co/epE4TO4Zgb
587,"With $40,000,000,000.00 plus the original $13 Billion for Big War’s/The D.C. Establishment’s official-unofficial war with Russia, how long till the kremlin parks some nuclear subs off our coast? What’s the over/under on how many of their +\- 6000 nuclear warheads will be onboard?"
588,What could go wrong?
589,Interesting. So we are at war? I assume with Russia? At least they’re saying it out loud finally… what could go wrong???
590,Everyone is welcome.
591,"Never let a good crisis go to waste. 

Baby Formula Shortage… 

“This is why we need late term and post term abortion” Democrats Probably."
592,".@RandPaul simply wanted an inspector general to oversee how $40 billion of your taxpayer dollars are being spent in Ukraine and the swamp went nuts. They don’t want transparency because it’s one giant kickback to their friends and Big War. 
I hope you’re awake &amp; watching!"
593,Interesting.
594,We are all MAGA KINGS. Get yours now ➡️ https://t.co/nsQ15uaZCk
595,"Hello, Ministry of Truth, I’d like to report a problem."
596,ULTRA MAGA &gt; ultra woke
597,Thread. Read it then ask yourself why the swamp finds it so outrageous.
598,"Well, Now that men can breastfeed this really shouldn’t be an issue anymore. Right guys… guys???"
599,"Definitely not grooming, it’s simply not happening… It’s a right wing conspiracy theory. (Much like all the others that have turned out to be 100% true)"
600,America Last is clearly today’s Democrat party platform.
601,".@RandPaul is a legend!!! We need 100 of him in the senate. 

Most Hurt: BIG WAR/Mil Industrial Complex, DC insiders getting Raytheon kickbacks, and generals looking for board seats… and those looking to get into a nuclear war over two corrupt NON-NATO countries."
602,"Do as we say not as we do PEASANTS!!!

The lack of any self-awareness whatsoever from the left is truly astounding."
603,If only Hollywood democrats cared as much about baby formula shortages as they do about a slight up charge for “vegan milk” in their overpriced coffee.
604,"As a verified Twitter user I agree and look forward to The Ministry of Truth granting me access to others’ tweets. 

Thanks in advance for your appreciation of TRUTH… 

DM me gurl!!!"
605,Too easy… https://t.co/9JbZsgtYBr
606,"IF??? IF men could have babies!!!

How dare you Sir?!? This kind of transphobia will not stand."
607,I was not aware that 49 was a majority in the US Senate. Big news if true.
608,"No one and I mean absolutely no one:

Madonna:"
609,"Looks like Joe is doing a great job of making inflation his top priority.  Remember folks, this is democrat policy... this is what you voted for... remember this in November."
610,"Everyone knew this a week ago… they don’t “appear” to be illegal they are illegal, and you would have been all over this in seconds with all the outrage you could muster if this was conservatives at Sotomayor’s house."
611,"I was told this was a “conspiracy theory” but like all conspiracies these days they seem to come true right after they served their purpose for the deep state, dems, and the media."
612,"Military industrial complex needed their kickback after watching Big Pharma at the trough for the last few years. It’s their turn folks, not to worry though, it will be covered as a “mostly peaceful” nuclear war if/when it escalates."
613,The Babylon Bee is STILL suspended on Twitter. Sign up for the Babylon Bee Newsletter to access content that big tech can’t censor. https://t.co/IOr2dbjGVm
614,"It has nothing to do with they party that controls the White House, the House of Reps and basically the Senate…Right?"
615,"It’s Trump… it’s the Russians… it’s transitory… it’s a good thing… 

It’s always someone else.

ITS ACTUALLY DEMOCRAT POLICY. THEY’RE DOING WHAT THEY SAID THEY WOULD DO. THANK THEM IN NOVEMBER FOLKS."
616,💯
617,"I look forward to all of the mainstream media carrying this story till November… LOL, he’s a Dem so he gets a pass 🦗🦗🦗"
618,Joe Biden: “The buck stops with…” ahhh never mind. It’s always just bullshit.
619,"Seems like the Democrat’s plan to combat the baby formula shortage is a war with Russia and easy access to 40 week abortions. Not what I’d go with, but then again we aren’t exactly dealing with the brightest people."
620,You can’t find baby formula in the United States right now but Congress is voting today to send $40 billion to Ukraine. Let’s put America First for a change.
621,It’s hard to find Baby Formula in Joe Biden’s America. Let that sink in.
622,"Donald Trump Jr. takes aim at Cheney, supports Hageman in new ad running in Wyoming’s GOP House primary

https://t.co/2SFqOh2OhH"
623,New TV ad supporting @HagemanforWY for Congress against liberal Liz Cheney in Wyoming!!! https://t.co/sOWBtCiRNu
624,"The Midterm Variant… be afraid, only the extreme competence of Joe Biden can save you!!!"
625,Totally normal and not shady at all 🙄
626,"Why is anyone surprised by the Chamber of Commerce doing Big Tech's bidding? They sold Republicans out in favor of the Democrats a long time ago!

Republicans trash Chamber of Commerce over Big Tech lobbying 

https://t.co/Lopd2Kt9w7"
627,Because criminals would obviously NEVER break the law!!! https://t.co/lsHTuixh4Q
628,"Thread. Note to conservatives, this is how you reply to regime propagandists. This is a classic tactic employed and we need to call it out. These reporters are not dealing in good faith and need to be out on notice."
629,"Everyone gets the propaganda here, but if leftist super PACs like The Washington Post can’t define women how can they be one of the groups that will somehow suffer most from free-speech? I guess they can only be defined when they can be used for political gain or marginalized? https://t.co/t0vIFmOqRY"
630,Dear democrats displays like this are really making me and everyone I know lean much more pro-choice. Please stop doing this so us conservatives have a chance this November! https://t.co/JZwpVvf5b6
631,I guess anything is better than sending Joe Biden.
632,The FBI won’t investigate this actual domestic terrorism because they’re too busy monitoring mothers who spoke up at their school board meetings who they called domestic terrorists.
633,So it’s a reporter committing the hate crimes that I’m sure he attributed to conservatives? How often is this happening? Given the activism I see from so many activists journalisming I imagine a lot.
634,"Dear America, what you’re experiencing now is what happens when you trust the media who tells you the guy that hid in his basement and can’t remember where he is much of the time would do a wonderful job as leader of the free world."
635,"People have had enough. Parents who were too polite and/or scared to speak up before are silent no more. The Teacher Union pushed lockdowns opened Pandora’s box. No more indoctrinating our kids. Teach them Math, Science, English and leave your bullshit leftist politics out of it."
