,tweet
636,Seems odd to leave out the child that’s killed in every procedure. No?
637,"Leftists, if men can get pregnant shouldn’t they be able to comment on abortion???"
638,"During the botched Afghan withdrawal the Biden administration sent missiles into Afghanistan killing almost a dozen innocent civilians and their media backers said nothing, but those same stooges are complaining about the Trump wanting to send missiles to take out drug cartels🤡"
639,I’m still trying to figure out the recent media outrage about my father possibly wanting to target Mexican drug cartel manufacturing facilities in Mexico… Is that supposed to be a bad thing???
640,Given the insane policies being pushed and implemented by the radical left these days can anyone make a credible argument that the democrat party itself isn’t the greatest threat facing everyday Americans and their prosperity?
641,"Donald Trump Jr. Torches Joy Behar After ‘The View’ Co-Host Floats ‘Sex Strike’ Over Roe Leak

https://t.co/SoPh6b7LAb"
642,Media Matters is a Democrat Super PAC posing as a non-profit. They are just as corrupt as Hunter Biden!
643,Books are selling fast! Get your copy of Our Journey Together now at https://t.co/HLcnyOgh5Z https://t.co/yvcHE3XSz7
644,I don’t think the ladies of the view participating in a “sex strike” is going to have the effect that they intended. Just sayin… https://t.co/9ZomMYHbyg
645,"Our govt, our justice system, and the upper echelons of federal law enforcement are corrupt and broken… watch this and see what they’ve become. I hate “Gestapo Tactic” analogies, they’re usually wrong &amp; overused, but not sure there’s another word for it! https://t.co/wszk1qKN36"
646,Flagging for you @elonmusk
647,"At this rate, it won't be long before Tim Ryan goes down the Ralph Northam path of endorsing post-birth abortions!!!"
648,Congrats @MaxMillerOH well done. #maga
649,I have some strong feelings on this one too.
650,My thoughts on @JDVance1’s YUGE win in Ohio. MAGA is alive and well and the GOP best take notice and finally understand where the people are.  https://t.co/jcIZNSadQu
651,RINOs are on the endangered species list.
652,"The GOP is now the MAGA party! 
America First!"
653,"Not easy to do, but glad to see it happen… Much respect @dolan4ohio"
654,"Tens of millions of RINO dollars spent to stop my man @JDVance1 in Ohio and they call it before 9 o’clock. The America First movement is alive and well people. Congrats JD, well done. https://t.co/Yhu3LEHjQF"
655,"I’m old enough to remember when medication that’s also used on horses was bad. Apparently horse medication is only bad when used to save a life but it’s totally fine when used to and one!

Anarchist Collective Shares Instructions to Make DIY Abortion Pills https://t.co/sNVZNbdzVM"
656,"Ohio friends - The day is finally here. We need MAGA to turn out in full force to vote today for the only Trump endorsed conservative running for US Senate, @JDVance1.

Let's send a message to the corrupt RINO establishment and send JD to the Senate to put America First!!! #OHSen https://t.co/O56STvuPpH"
657,"The irony of leftists chanting ""My Body My Choice"" who could not have cared less about other peoples body choices for the past two years of vaccine mandates can't be overstated!

Many rejoiced at the prospect of people who didn't want to get vaxed losing their jobs because of it"
658,"If there's not thorough criminal investigation into who leaked privileged documents from the United States Supreme Court then we live in a clown show state.

For Perspective: The FBI sent 15 people to investigate a garage pull."
659,"This is exactly why my father and I are both supporting @JDVance1 for Senate in Ohio. 

The entire MAGA movement in Ohio needs to unite behind JD to defeat the corrupt RINO establishment!!!"
660,"The propaganda being used to get us into a war with Russia is truly amazing. I guess I’ve seen so much nonsense that I’ve become cynical, but you had to know this one was fake right when it broke… unless you’ve been in a coma for the last few years."
661,Good point… It’s amazing what government can do when they’re motivated correctly. Shame they’re so seldom motivated to actually do anything other than for themselves and their cronies.
662,"Since they’re so busy looking for racism, you’d think they would have asked Joe or Hunter about Hunter’s rather Prolific use of the N Word. 
I guess they’re too busy being the Dem’s marketing dept."
663,It’s sad that this isn’t even a little surprising anymore.
664,"The left/media would lose their minds if Trump created a ministry of Truth, why are they silent on Biden?… unless it was never really about the truth."
665,Apparently Hunter isn’t the only Dem smoking crack.
666,"The only candidate running for Senate in Ohio who my father and I trust to fight back against the RINO establishment and put America First is @JDVance1!!!

House firebrands Gaetz, Greene say Vance is the Senate ally they need in rowdy campaign stop

https://t.co/rSppAZEeUQ"
667,Stop giving these people your hard earned money.
668,It’s pretty awesome that AOC helped Elon Musk buy Twitter. https://t.co/vehZdb237w
669,Sad but not surprising given that it seems they’re more worried about wokeness than military preparedness.
670,"If my father becomes President again, I think I’ll throw my name in the hat to head the Ministry of Truth. People should be fine with this given the other sides appointment."
671,"The entire RINO establishment is going into overdrive trying to stop @JDVance1 because they know that they can't control him. 

JD is a fearless MAGA fighter!!! #OHSen 

https://t.co/9VHUso6Ur5"
672,They clearly just want to date you… even Peter apparently.
673,The adults are back in charge.
674,@MariosTortas @mariolopezviva While the Tortas are delicious… definitely try AC Slater’s sliders too.
675,"That’s not the meme he shared, but you know that, and you know it’s fine to spread this miss-info since the new ministry of truth will give you a pass because you play for the same untruthful team."
676,"Of course they should… The fact that kids can graduate high school without a basic understanding of these things is ludicrous, but of course they’ll never actually learn them because they’re too busy learning made up pronouns and genders."
677,Profits/Quarterly Earnings.
678,"Dems can’t read the room. While Americans suffer, Democrats run with their vanity projects like making sure men can play in women’s sports and making sure teachers can teach explicit sexual content to toddlers without parents consent. I’m sure these will be winning issues in Nov."
679,"Historically, was there ever a despotic regime that didn’t have the equivalent of a Ministry Of Truth?"
680,What would they say if Trump created a #MinistryOfTruth?
681,"Ohio pay attention to the below and make sure you’re voting for @JDVance1. You’ve seen what the RINOs will do for America and it’s not pretty, so don’t let them get elected."
682,"Our new Minister of Truth seems insane. Seems she also totally bought into every piece of misinfo of the last half decade. I know, I know… None of this is about misinformation, and it never was."
683,https://t.co/w2L85twOv9
684,"🚨#OHSen🚨

@JoshMandelOhio is outed as the establishment RINO fraud he truly is. 

Mandel serves Mitch McConnell and is owned by the GOP establishment. MAGA can not trust him - Don't be fooled by this RINO fraud!!! https://t.co/ptNHuxw40f"
685,"Biden is asking for $33 Billion to send to Ukraine on top of the billions already sent to the very corrupt nation, but they couldn’t spend a tiny fraction of that to finish the wall, secure our border &amp; end the humanitarian crisis &amp; drug/sex trafficking at our border!#AmericaLast"
686,Great time with @TuckerCarlson talking not just the flagrant attacks on our First Amendment rights but the dual attacks on the Second. We must fight for all of our rights and not allow the democrats to destroy our freedoms and our rights. #2ATF https://t.co/fzm3rCw6Vo
687,"Brutal!!!

Piers Morgan Viewership Crashes 70 Percent After Trump Aide Crushes His Mishandling of Deceptively Edited Interview Promo

https://t.co/d57omed3ow"
688,Please have your new Minister of Propaganda review this for misinformation.
689,Fixed it for you: Biden admin focuses on anything but the stuff that actually effects hard working Americans who are struggling due to his/Democrat’s gross incompetence.
690,"🚨New Ohio Senate Poll!!! #OHSen🚨

Vance: 31%
Mandel: 19%
Dolan: 12%
Gibbons: 12%
Timken: 8%

Exclusive: Trump-Endorsed J.D. Vance Takes Commanding Lead in New Poll

https://t.co/BgSLxoGbh8"
691,"Rather than having the middle class pay off/subsidize the elite’s student loans, why don’t we address the absurd cost of college, their multi-billion $ tax free endowments &amp; the ever declining value proposition of the worthless degrees that so many drive themselves into debt for?"
692,"Hard pass. How about we use it to help Americans in need? Or to perhaps secure out border? Maybe get our energy sector going again? Education? 

No, instead we’ll give it to one of the most corrupt countries in the world, where I’m sure most will be looted by corrupt politicians."
693,Can’t just Blame Joe Biden. Few believe he’s capable of coming up with these policies. What he’s signing into law is DEMOCRAT POLICY. Leftist are doing what they said they would do and we are feeling the consequences of their stupidity. Remember that!
694,Not unexpected for anyone who has purchased anything lately.
695,Strange that she would warn us about this since fascism seems to be a major component of the democrat party platform. Was this speech the same day Biden announced his ministry of truth?
696,"Excellent. This is like an in kind contribution to the Republican Party. While they’re being so helpful can we also see a lot more of Kamala. 

Biden ramping up for the midterms: 'Expect more POTUS’ | Fox News https://t.co/pOscRfVZUu"
697,…So to make sure there are no abuses of power we are going to create a hyper-partisan government controlled Ministry of Truth!!!
698,"Who is the real @JoshMandelOhio?

Well his mentor in politics was neocon RINO BIll Kristol. 

Which explains why Josh supports a ""European led"" no-fly-zone in Ukraine. #OHSen https://t.co/PdRawwm8YH"
699,Wrong. They’re still our kids and we as their actual parents want to know what they’re being taught. We want to make sure they’re not being indoctrinated. We want them to learn math not imaginary genders and leftist bullshit. We want our kids to be successful… not crackheads.
700,The left is not interested in neutrality. To them it’s bullying if you take away their upper hand.
701,"I’d be willing to bet that I didn’t visit the White House 27 times to see my own father, but Joe definitely never met with Hunter’s business partner in more than two dozen visits."
702,Well the Dems have to bribe their electorate handsomely… those gender studies PHDs don’t come cheap nor do they pay well if at all.
703,"This insanity from the Biden administration is precisely why the senate &amp; Ohio needs @JDVance1 who will not just kowtow to Dems &amp; the establishment to allow this kind of inevitable gross partisanship controlling free-speech in America.

Establishment RINOs will give it all up."
704,"You’re right, all the woke activist shareholders at Twitter who are going to receive the $44 billion should donate it all to climate change. 

It will be fascinating to see how much they actually give away. My guess is about none of it."
705,"No one in congress has spread more disinformation than this guy, but because he’s a leftist there’s no consequences. Whatever happened to all the Russia Collusion info he said “saw with his own eyes”? Or the altered emails like @Jim_Jordan’s and mine? America is still waiting."
706,Would be a great start.
707,Seems Shadow Banning is yet another “right-wing conspiracy theory” that was 100% true.
708,"Hello, 911… I’d like to report a murder!"
709,"While I’m awesome and totally deserving of 87,000 new followers a day it seems that someone took the shackles off my account. Wonder if they’re burning the evidence before new mgmt comes in? https://t.co/9Mso48qyNP"
710,Is this the greatest self-own of all time? Do they really not know that this is what has been done to conservatives for the last few years? I genuinely don’t think they get it. They really thought that we were on an equal footing here. Amazing https://t.co/agJp91ztFY
711,"Enough is enough. Radical leftists are seeking to indoctrinate American children, pushing Critical Race Theory in schools. And the media gaslights parents and covers it up. Demand that the institutionalized racism of CRT be removed from schools here now! https://t.co/bAXuqVQRzU"
712,"The same pro-China group funding career politician @JoshMandelOhio, spent $10 million to stop Trump in 2016 &amp; are spending millions today to stop @JDVance1.

JD stands with MAGA on using tariffs against China, while Mandel is owned by the weak on China RINO establishment. #OHSen https://t.co/Q3eQU96WJi"
713,This perfectly sums up the left. To them Elon Musk’s aptitude is determined by his degrees &amp; not the fact that he did what all the Phds at NASA combined can’t seem to do efficiently. They think Phds in gender studies are worth more than real people with actual accomplishments!
714,White Flight???
715,With the receipts!!! It was always bullshit… they all knew it but that didn’t matter at all.
716,https://t.co/TN1Q8b6GLQ
717,That alone is worth $44 billion.
718,"Ohio is fired up to elect @JDVance1!!! 

#OHSen"
719,Never skip range day
720,"Read my new OpEd about why all America First conservatives should support @JDVance1!

""While nearly every candidate running for Senate proclaims themselves to be ""America First,"" Vance stands out from the pack because of his genuine populist convictions""

https://t.co/L1ZXTcSAxr"
721,@RyanGirdusky Ok that’s pretty funny.
722,Nunes: Truth Social fully launched for iPhone users https://t.co/BM5UbVRf1e
723,"More importantly, I’ll never forget him as the one GOP senator who voluntarily showed up and sat through my Russia Russia Russia inquisition simply as a show of support for what he too new to be nonsense. Thank you again sir! R.I.P."
724,"Sorry to hear of the passing of my friend Senator Orrin Hatch. A man of great integrity who got what was going on in 2016 and became an unlikely ally &amp; mentor, bringing some much needed perspective to a political neophyte like me. https://t.co/QhyGcGmjER"
725,"This is America First @JDVance1 

https://t.co/VRjAEzspER"
726,Must watch!!! https://t.co/IzdrIEM7V8
727,Fact Check: True
728,"WATCH THIS RIGHT NOW 🔥🔥🔥

""The leadership of the Republican Party sold us out on trade. The leadership of the Republican Party has fought consistently against strong &amp; secure borders."" - @JDVance1 to @TuckerCarlson  #OHSen https://t.co/GxldT4x6Ya"
729,This Tennessee swamp creature was endorsed by a guy who spent the last week praising Hitler and making anti-Semitic comments about my sister. She hasn’t condemned his comments. I’m thinking maybe she shouldn’t be teaching kids about history or serving in congress. #TN05
730,They should get the money from all those who have the Ukraine 🇺🇦 in their bio… or was that all just virtue signaling. I’m sure a couple dollars of this will actually go to something other than corrupt govt officials. https://t.co/kvqvsxk2IL
731,99.99% I’ll keep wearing one so I can stay under the radar.
732,Dems should love that they’re going to tax the rich and make them pay “their fair share”
733,"You mean do exactly what the Democrat controlled Main Stream Media has been doing for decades!?! 

Yea. I’m actually with you on this one."
734,"Ohio friends - Meet the real @JoshMandelOhio. 

The Club for Chinese Growth backed establishment candidate in the #OHSen race. 

https://t.co/RTZEfGo3i6"
735,"The RINO frauds attacking @JDVance1 HATE him precisely because they know he will shake up the establishment and put America First in the Senate!

#OHSen https://t.co/ngEN6LmvzS"
736,"The radical left is on the attack, &amp; they’re gunning for true conservatives like @SarahHuckabee Sanders. We need to have her back. Stand with Sarah as she stops the radical left from taking over our by donating to her campaign for Governor of Arkansas here!https://t.co/0ZXcSz5ZgB"
737,Donald Trump Jr. vouches for Vance in Ohio Senate race | The Blade https://t.co/YqavtLRdQN
738,Celebrating the life of CNN+ https://t.co/n0p5KRStgi
739,"Netflix: we can’t figure out why we’re hemorrhaging hundreds of thousands of subscribers. 

Also Netflix: https://t.co/sDGqiXL75l"
740,"Other than everyone, who could have seen this coming???"
741,Must be a lib poll. I’ve flown out of Miami &amp; Cleveland in the last 2 days and about 90% of people are massless. I’m sitting in an airport now and I can see 60+ people and can count 5 masks including me but I’m wearing one for anonymity not bc I think a small cloth does anything
742,He literally has no idea.
743,This is what America First looks like.
744,"Actual audio is in the Breitbart story… it’s totally brutal how misleading and deceptive the Morgan promo edit is. 

Deceptive Edits: Audio Contradicts Piers Morgan, Shows He Warped Trump Interview Ending in Promo https://t.co/6Prc6OUQir"
745,"Yikes!!!

The Bulk of Liz Cheney’s Donations Have Come from Outside Wyoming

https://t.co/A9paZHw4dh"
746,Where’s the WAPO Expose on this sicko? Millions of Americans would be far more interested in what he wants to teach our children than they are in learning about the person behind an account that reposts todays’s left in their own words.
747,The democrats can’t let go of the stranglehold they had on you and all aspects of your lives. It’s not about science it’s about control and they ain’t giving it up if they don’t have to.
748,"Bring Back The Bee!!! 🐝 

The Babylon Bee is STILL suspended here on Twitter. Sign up for their newsletter to stay ahead of the censorship. https://t.co/2m8vIxuzVL"
749,@washpostbiz I’m just here for the ratio.
750,I think she’s just upset that others would use her own tactics against her… the ordinary citizens calling her out though don’t have the full backing of Jeff Bezos’ Washington Post to really pressure others into silence and further disseminate their info for future reprisal.
751,"The question @libsoftiktok often raises — &amp; the Left wants to ignore — is do parents have a right to know what their children are being taught in their public school, or not? No @TaylorLorenz hit piece can change the fact that America’s parents are with us, not the groomers."
752,"What are the two things that all of these people &amp; institutions have in common?

1. They all hate &amp; oppose Donald Trump

2. They all hate &amp; oppose @JDVance1

The same America Last establishment that hates Trump, hates JD...And that's exactly why we need to send JD to the Senate! https://t.co/GqIl9nS67T"
753,"Looks like the only thing that Joe Biden and the Democrats built back better is ISIS. 

ISIS Calls For Attacks in Europe Urging to Take Advantage of Ukraine War https://t.co/LiiPDDT8Df"
754,"This is exactly right. Enough of the weak RINOs who talk a good game and then sell out the America First agenda.

We need more #MAGA fighters like @JDVance1 who will actually fight for the America First agenda on immigration, trade, ending endless wars &amp; breaking up Big Tech."
755,"Radical leftists are seeking to indoctrinate American children, pushing Critical Race Theory in schools. And the media gaslights parents and covers it up. Help @prageru and demand CRT be removed from schools. https://t.co/bAXuqVQRzU"
756,"Don’t forget to pay your taxes today… There are people all over the world, many of whom hate your guts, who are depending on it."
757,"Join President Trump and me in supporting @JDVance1's campaign with a small donation. The RINO establishment is doing everything they can to stop JD because they know that he will fight to put America First in the Senate!

DONATE:

https://t.co/z3ztu0Z8G3"
758,"My dad and I are both supporting America First champion @JDVance1 for Senate because he's a conservative fighter who will stand with us against the radical left and the weak establishment RINOs in Washington DC! 

#OHSen https://t.co/dxEJU0Yofp"
759,Happy Easter everyone
760,I’ve never seen a forum fight so hard to make sure that free speech is prohibited… I mean outside of fascist dictatorships of course.
761,MAGA Crowd Praises Trump's Endorsing J.D. Vance: 'The Right Choice!' https://t.co/jwsjlkjnCV
762,Have we heard anything about the motives of the NYC shooter yet? Seems we always hear about those things but no one has any interest in motive or even the story anymore… oh yea. NVM.
763,"I’ve gotten to know @JDVance1 personally over the past year &amp; I'm convinced that he's 100% America First.

The leftwing media, the Dems &amp; the weak RINOs all HATE him because they know he stands with #MAGA.

He's the real deal folks, that's why my dad &amp; I are both supporting him!"
764,Rigged
765,"Elon Musk controlling Twitter and allowing for free speech is literally worse than Pearl Harbor!!!

You know it’s coming folks"
766,It ain’t just Twitter censoring… it’s all of tech… and media who probably wouldn’t write the story if it was served up to them on a silver platter.
767,"As if the rabid censoring here wasn’t enough for the Twitter board to be violating their fiduciary responsibilities to shareholders, they’re now turning down an offer of almost double what Twitter’s bankers at Goldman Sachs said people should sell at. The lawsuits should be fun."
768,Textbook
769,"Was Frank James declared innocent? If not, it’s amazing that he could be totally out of the news cycle despite shooting 10 people earlier this week. 
What happened? (Allegedly)"
770,Thread
771,I was told any kind of nationalism was terrible… since I’m hearing nothing about it I guess not. Wonder why🙄
772,Hahahaha
773,"Here we go folks. Fitness is racist coming soon, because it really sucks to want to be healthy and strong rather than just being a sick weakling."
774,Democrats won’t let a parent pick their child’s school but they’ll let a child pick their gender.
775,"The Biden Administration is on a path to destroying our country, but the America First movement is not over. The America First Policy Institute is protecting American values and building a brighter future for all.
Click learn more! @A1Policy. https://t.co/JUCRDEvG6s"
776,"Oh I thought she was a “real” conservative who just didn’t like Trump.🤡 Ask defenseless Americans whose property was burned down in the riots if they didn’t need an AR-15. Ask Chinese citizens getting beat for coming outside, or the Uyghurs if they don’t need AR-15s. SELLOUT!"
777,Why do the security cameras never seem to work when the reality of the crime isn’t good for the leftist narrative???
778,Shocked 🙄
779,Great work NYPD. Despite the constant attacks from the leftist leaders of New York you guys still get it done… unlike the FBI leadership who seem far more interested in creating crimes and letting the actual bad guys go.
780,This should surprise exactly no one who has been watching.
781,"I thought they went to some lengths to say it wasn’t terror? Maybe because they described the terrorist and the description wasn’t good for the narrative. 

Man arrested in Brooklyn subway attack charged with terror | AP News https://t.co/aGPuuLUAwp"
782,"Brooklyn subway shooting suspect was on FBI's terrorist radar till 2019 then they got too busy chasing down garage pulls, interrogating your grandmother who took a selfie on J6, &amp; trying to frame/entrap some meth-heads in Michigan.

Has FBI brass ever prevented/solved anything?"
783,"Radical leftists are seeking to indoctrinate American children, pushing Critical Race Theory in schools while the media gaslights parents and covers it up. 
It’s time to demand CRT be removed from schools now! Help by signing up here!!! https://t.co/bAXuqVQRzU"
784,What would possibly lead CNN to believe people were going to pay for something that basically no one watches for free? (other than at airports) https://t.co/ikJzHVAeKb
785,"You’d think given their sentiments in animals Disney would be really vocal about China confiscating it’s citizens let’s and murdering them in the streets somehow under the guise of public safety, but you’d be wrong… they’re silent on all China’s atrocities."
786,If this is accurate watch how quickly the media will make the entire story disappear.
787,"Even the birds know. Apparently a bird just shit on Biden in Iowa. That bird speaks for anyone who’s filled their tank or gone shopping in the last 18 months. 
 https://t.co/fYeoWM9Nep"
788,Hope all those Biden voters are really enjoying their 8.5% pay cut. #inflation
789,It’s science!!!
790,"So sorry to hear this. Gilbert was a great guy and a comedic genius. 
R.I.P."
791,"Remember when Biden gave you a ONE TIME $1200 kickback in his “American Rescue Plan,"" that printed $2 trillion out of thin air. Democrats will now cost the avg American over $5000 PER YEAR that this continues in higher costs due to inflation! Great work!

Stop voting for Dems."
792,"8.5% inflation. The highest in 40 years. This is what Democrat policies get you. You just got an effective 8.5% pay cut, but don’t worry I’m sure all the Pelosi Dems in DC who are insider trading legally will make up for that difference and be fine.

You, however are screwed!"
